{
  "event_count": 33,
  "feature_slug": "042-agent-skills-installer-infrastructure",
  "last_event_id": "01KM6429D4584C9FPBKFZJFFGM",
  "materialized_at": "2026-03-20T17:18:09.316457+00:00",
  "summary": {
    "approved": 1,
    "blocked": 0,
    "canceled": 0,
    "claimed": 0,
    "done": 0,
    "for_review": 0,
    "in_progress": 2,
    "planned": 1
  },
  "work_packages": {
    "WP01": {
      "actor": "user",
      "force_count": 5,
      "lane": "approved",
      "last_event_id": "01KM62WNPV2HK6AYZJZ0ECA6P1",
      "last_transition_at": "2026-03-20T16:57:36.731954+00:00"
    },
    "WP02": {
      "actor": "codex",
      "force_count": 3,
      "lane": "in_progress",
      "last_event_id": "01KM63MJB1EXKNH3Q1XEKWNP7G",
      "last_transition_at": "2026-03-20T17:10:39.713184+00:00"
    },
    "WP03": {
      "actor": "user",
      "force_count": 3,
      "lane": "planned",
      "last_event_id": "01KM63XEYC3KD3K08F18ADNNEW",
      "last_transition_at": "2026-03-20T17:15:31.148303+00:00"
    },
    "WP08": {
      "actor": "codex",
      "force_count": 4,
      "lane": "in_progress",
      "last_event_id": "01KM6429D4584C9FPBKFZJFFGM",
      "last_transition_at": "2026-03-20T17:18:09.316072+00:00"
    }
  }
}
