{
  "event_count": 6,
  "feature_slug": "048-full-lifecycle-telemetry-events",
  "last_event_id": "01KHKJBS1FX0Y7DXDZBXS16NDD",
  "materialized_at": "2026-02-16T15:51:02.448082+00:00",
  "summary": {
    "blocked": 0,
    "canceled": 0,
    "claimed": 0,
    "done": 2,
    "for_review": 0,
    "in_progress": 0,
    "planned": 0
  },
  "work_packages": {
    "WP01": {
      "actor": "user",
      "force_count": 2,
      "lane": "done",
      "last_event_id": "01KHKJ9P5R61W4QWT6VZSWKDMX",
      "last_transition_at": "2026-02-16T15:49:53.976032+00:00"
    },
    "WP02": {
      "actor": "user",
      "force_count": 2,
      "lane": "done",
      "last_event_id": "01KHKJBS1FX0Y7DXDZBXS16NDD",
      "last_transition_at": "2026-02-16T15:51:02.447466+00:00"
    }
  }
}
